{
  "type": "LedgerEvent",
  "urn": "aesynth:gov:ledger/evt-000126",
  "timestamp": "2025-11-01T05:05:20Z",
  "event": "resolution.ratify",
  "subject": "aesynth:gov:res/2025-11-01-ratify-aesynth-constitution-1-0",
  "refs": [
    "aesynth:gov:doc/aesynth-constitution@1.0.0"
  ],
  "actor": "aesynth:gov:actor/provisional-steward",
  "sha256": "2244d091ffb2c1c530ee448fdce91fe71bb5dbd8d2ba578bcd811e2e594482c0",
  "jws": null
}
